{"run":45,"commit":"cfb88ef","metric":790.645,"metrics":{},"status":"discard","description":"Noise-check rerun of the current CUDA baseline at the kept decoder single-token fast path. Quality stayed exact on both transcript guards and this run came in slightly faster than the recorded best (790.645ms vs 793.356ms), but there was no code change, so this is just benchmark noise rather than a real new optimization.","timestamp":1773978041021,"segment":1,"confidence":1.0267011197243754}
{"run":46,"commit":"30476ab","metric":772.933,"metrics":{},"status":"keep","description":"Pipelined CPU mel extraction across chunk boundaries for multi-chunk GPU transcriptions. `Qwen3ASRModel::transcribe` now computes the next chunk's mel spectrogram on a background thread while the current chunk is running through the CUDA encoder/decoder, then reuses the precomputed mel data in a new `transcribe_chunk_from_mel` path. This preserves short_exact=1 and long_exact=1 while improving wall_ms from 793.356ms to 772.933ms (~2.6% faster, 77.63x realtime).","timestamp":1773978359637,"segment":1,"confidence":1.9142375105445717}
{"run":47,"commit":"30476ab","metric":772.967,"metrics":{},"status":"discard","description":"Tried replacing the generation loop's one-element `to_vec1::<u32>()?[0]` argmax extraction with a scalar path (`argmax(...).i(0)?.to_scalar::<u32>()`) to shave per-token CPU bookkeeping. Quality stayed exact, but wall_ms was effectively unchanged and fractionally worse than the current best (772.967ms vs 772.933ms), so this micro-optimization is not worth keeping.","timestamp":1773978535596,"segment":1,"confidence":1.8680142687277066}
{"run":48,"commit":"30476ab","metric":774.588,"metrics":{},"status":"discard","description":"Tried constructing the mel tensor directly in BF16 on CUDA by converting the CPU mel buffer to `half::bf16` first, so the hot path could skip Candle's `to_dtype(BF16)` cast after upload. Quality stayed exact, but wall_ms regressed to 774.588ms, so the extra CPU-side conversion costs more than the saved GPU cast.","timestamp":1773978617638,"segment":1,"confidence":1.5099068460742326}
{"run":49,"commit":"9b6bd76","metric":772.765,"metrics":{},"status":"keep","description":"Cached the static ChatML prompt token IDs inside `Qwen3ASRModel` at load time, so each chunk reuses the same precomputed `system/user/assistant` token vectors instead of re-tokenizing and rebuilding them during generation. Quality stayed exact on both transcript guards and wall_ms improved slightly from 772.933ms to 772.765ms, though this gain is close to the current noise floor.","timestamp":1773978825122,"segment":1,"confidence":1.3823174006444727}
{"run":50,"commit":"9b6bd76","metric":772.199,"metrics":{},"status":"discard","description":"Noise-check rerun of the current kept baseline after caching the static prompt token IDs. Quality stayed exact and this rerun came in slightly faster again at 772.199ms, which is directionally consistent with the kept change but still not a separate code improvement.","timestamp":1773978851997,"segment":1,"confidence":1.2564681474249517}
{"run":51,"commit":"7b6264b","metric":772.061,"metrics":{},"status":"keep","description":"Extended the static prompt caching path by materializing the reusable pre-audio and post-audio prompt token tensors once at model load, so each chunk can feed those tensors directly into the decoder embedding lookup instead of rebuilding them on the hot path. Quality stayed exact and wall_ms improved slightly again from 772.765ms to 772.061ms, though this is still a very small gain near the benchmark noise floor.","timestamp":1773978948663,"segment":1,"confidence":1.134644075021309}
{"run":52,"commit":"7b6264b","metric":775.551,"metrics":{},"status":"discard","description":"Tried caching the static prompt embeddings themselves at model load and concatenating those cached embedding tensors directly with the per-chunk audio features, to remove the prompt embedding lookup from the hot path. Quality stayed exact, but wall_ms regressed to 775.551ms, so keeping those extra device tensors live is slower than recomputing the tiny prompt embeddings each chunk.","timestamp":1773979095743,"segment":1,"confidence":1.2136669326342169}
{"run":53,"commit":"7b6264b","metric":774.771,"metrics":{},"status":"discard","description":"Tried avoiding the initial zero-fill of the mel output buffer by switching `MelSpectrogram::compute` from indexed writes into a pre-zeroed vector to a reserved `Vec::push` path. Quality stayed exact, but wall_ms regressed to 774.771ms, so the indexed pre-sized mel buffer is still the better implementation.","timestamp":1773979441846,"segment":1,"confidence":1.3262128666625108}
{"run":54,"commit":"7b6264b","metric":718.492,"metrics":{},"status":"discard","description":"Tried fusing the decoder attention's three separate no-bias `q_proj`/`k_proj`/`v_proj` matmuls into a single combined `qkv` projection and then splitting the result back into Q/K/V slices. It was much faster on CUDA, but long_exact dropped to 0 because the repeated-workload transcript changed from the established `tsunzhu` wording to `sun zhu`, so this naive QKV fusion is not numerically equivalent enough to keep.","timestamp":1773979623165,"segment":1,"confidence":1.2683522439620039}
{"run":55,"commit":"b3bcf5b","metric":766.64,"metrics":{},"status":"keep","description":"Added a fused `qkv` projection only for the CUDA `seq_len == 1` decoder hot path, while leaving the original separate `q_proj`/`k_proj`/`v_proj` matmuls in place for longer prompt/prefill passes. This preserves short_exact=1 and long_exact=1, avoids the `sun zhu` regression from the full fusion experiment, and improves wall_ms from 772.061ms to 766.640ms (~0.7% faster, 78.26x realtime).","timestamp":1773979752585,"segment":1,"confidence":1.6801459027734158}
{"run":56,"commit":"79563cf","metric":761.848,"metrics":{},"status":"keep","description":"Refactored the decoder's `seq_len == 1` CUDA QKV fast path to share one fused `qkv` weight tensor with narrow-view `q_proj`/`k_proj`/`v_proj` wrappers, instead of keeping a second duplicate set of projection weights just for the decode fusion. Quality stayed exact on both transcript guards and wall_ms improved again from 766.640ms to 761.848ms (~0.6% faster, 78.76x realtime).","timestamp":1773979854014,"segment":1,"confidence":2.0019060931444237}
{"run":57,"commit":"882d2ff","metric":720.438,"metrics":{},"status":"keep","description":"Added a fused `gate_up` projection for the decoder MLP's CUDA `seq_len == 1` hot path, while keeping the longer prompt/prefill path on exact narrow-view `gate_proj`/`up_proj` wrappers derived from the same shared weight tensor. Quality stayed exact on both transcript guards and wall_ms improved sharply from 761.848ms to 720.438ms (~5.4% faster, 83.28x realtime).","timestamp":1773979944664,"segment":1,"confidence":4.6811324388521545}
{"run":58,"commit":"882d2ff","metric":721.839,"metrics":{},"status":"discard","description":"Tried extending the fused decoder MLP `gate_up` projection from the CUDA `seq_len == 1` hot path to all CUDA sequence lengths, so the longer prompt/prefill pass would also use the shared fused matmul. Quality stayed exact, but wall_ms regressed slightly to 721.839ms versus the current best 720.438ms, so the fusion only pays off on the single-token decode path.","timestamp":1773980027189,"segment":1,"confidence":5.146123716433174}
{"run":59,"commit":"882d2ff","metric":724.726,"metrics":{},"status":"discard","description":"Tried pushing the decoder `seq_len == 1` CUDA fast paths further by squeezing the hidden state to 2D for the fused QKV and fused `gate_up` matmuls, then unsqueezing back to 3D afterward. Quality stayed exact, but wall_ms regressed to 724.726ms, so Candle's existing 3D linear path is better than manually bouncing through 2D here.","timestamp":1773980195995,"segment":1,"confidence":4.3868367224160565}
{"run":60,"commit":"882d2ff","metric":721.045,"metrics":{},"status":"discard","description":"Noise-check rerun of the current best decoder-fusion baseline after the kept QKV and `gate_up` CUDA decode-path changes. Quality stayed exact and the result remained far better than the old baseline at 721.045ms, but there was no new code change in this run.","timestamp":1773980236521,"segment":1,"confidence":3.8285204242360735}
{"run":61,"commit":"882d2ff","metric":724.547,"metrics":{},"status":"discard","description":"Tried fusing only the decoder attention `k_proj` + `v_proj` matmuls on the longer CUDA prompt/prefill path while keeping `q_proj` separate and preserving the existing `seq_len == 1` full-QKV decode fusion. Quality stayed exact, but wall_ms regressed to 724.547ms, so the prompt-side KV-only fusion does not pay for itself here.","timestamp":1773980387473,"segment":1,"confidence":3.143559234350762}
{"run":62,"commit":"882d2ff","metric":108.423,"metrics":{},"status":"discard","description":"Tried merging the decoder's single-token CUDA `q_norm` and `k_norm` calls into one combined RMS-norm launch by concatenating Q and K along the head axis, normalizing once, and then splitting them back apart. That was not numerically equivalent in practice: the transcripts collapsed (`short_exact=0`, `long_exact=0`, empty long output), so the two Q/K norm paths must stay separate.","timestamp":1773980449597,"segment":1,"confidence":3.0601812993117448}
{"run":63,"commit":"882d2ff","metric":723.371,"metrics":{},"status":"discard","description":"Tried re-enabling the fused decoder `qkv` projection on the longer CUDA prompt/prefill path for just the last four transformer layers, while keeping the current decode-only fusion everywhere else. Quality stayed exact, but wall_ms regressed to 723.371ms, so even a small subset of prompt-side QKV fusion is slower than the current baseline here.","timestamp":1773980608891,"segment":1,"confidence":2.9811120196238714}
{"run":64,"commit":"882d2ff","metric":733.741,"metrics":{},"status":"discard","description":"Tried merging the decoder's single-token CUDA rotary-embedding work into one `rope_thd` launch by concatenating Q and K along the head axis, applying RoPE once, and splitting the result back apart. Quality stayed exact, but wall_ms regressed badly to 733.741ms, so the extra concat/split overhead outweighs the saved kernel launch.","timestamp":1773980706707,"segment":1,"confidence":2.9631827048114365}
{"run":65,"commit":"882d2ff","metric":756.265,"metrics":{},"status":"discard","description":"Tried changing mel extraction to emit mel-major data directly for `(1, n_mels, n_frames)` tensors so the hot path could skip the per-chunk Candle transpose before the audio encoder. Quality stayed exact, but wall_ms regressed heavily to 756.265ms, so the extra CPU-side transposition work is much worse than letting Candle handle the tensor transpose.","timestamp":1773980837422,"segment":1,"confidence":2.9589741508744845}
{"run":66,"commit":"882d2ff","metric":736.28,"metrics":{},"status":"discard","description":"Tried collapsing the per-chunk prompt embedding setup into one decoder embedding lookup over a precomputed concatenated pre+post prompt token tensor, then splitting the resulting embeddings back into pre/post slices. Quality stayed exact, but wall_ms regressed to 736.280ms, so two tiny embedding lookups are still better than one larger lookup plus extra slicing.","timestamp":1773980929428,"segment":1,"confidence":2.8584084672677266}
{"run":67,"commit":"882d2ff","metric":739.033,"metrics":{},"status":"discard","description":"Tried shrinking the decoder KV cache's initial capacity from 2048 to 1024 tokens so the warm reusable CUDA cache buffers would consume less memory. Quality stayed exact, but wall_ms regressed to 739.033ms, so the smaller initial cache does not help steady-state throughput here.","timestamp":1773981026612,"segment":1,"confidence":2.7644538802744747}
{"run":68,"commit":"882d2ff","metric":722.782,"metrics":{},"status":"discard","description":"Retried the old generation-housekeeping idea in a narrower form by pre-reserving capacity for the decoded token buffer inside `generate`. Quality stayed exact, but wall_ms still regressed slightly to 722.782ms, so token-buffer growth is not a meaningful bottleneck even after the bigger decoder CUDA wins.","timestamp":1773981074072,"segment":1,"confidence":2.7305510307251595}
{"run":69,"commit":"882d2ff","metric":799.795,"metrics":{},"status":"discard","description":"Tested a single combined decoder KV cache tensor so each generated token would do one CUDA `slice_set` append for concatenated K/V instead of separate writes into independent K and V caches. Quality stayed exact, but wall_ms regressed badly to 799.795ms, so the extra K/V concatenation and splitting overhead outweighs the saved cache write.","timestamp":1773981276082,"segment":1,"confidence":2.7179812136573758}
